{
  "schemaVersion": "1.0",
  "syntheticInventoryId": "dhaka-hospital-qualification-20260729-v2",
  "syntheticInventoryVersion": "2.0.0",
  "derivedFromOfficialCapacityReferenceId": "dhaka-government-hospital-capacity-20260729-v2",
  "derivedFromOfficialCapacityReferenceSha256": "eac6ec909452f4a2967fdb34b882d01c10f7267dda981d32fe75ed55c91338f4",
  "evidenceScope": "synthetic_qualification",
  "operationalDhakaValidation": false,
  "syntheticData": true,
  "operationalUseAllowed": false,
  "clinicalUseAllowed": false,
  "hospitalDecisionUseAllowed": false,
  "scenarioPolicyId": "HOSPITAL.INVENTORY.SYNTHETIC.QUALIFICATION",
  "scenarioPolicySha256": "dae554e9a7c831757f6139ecbcb516a24161a8a34fcec4d8dfde23db8b383c81",
  "allocationMethod": "synthetic_capacity_proportional_qualification",
  "operationalAllocationApproved": false,
  "scenarios": [
    {
      "scenarioId": "baseline_availability",
      "availabilityFraction": "0.300000",
      "allocationShareTotal": "1.000000",
      "hospitals": [
        {
          "hospitalId": "mugda-medical-college-hospital",
          "eligibility": "potentially_eligible",
          "participationStatus": "included",
          "managementDecisionStatus": "pending_review",
          "allocationShare": "0.054651",
          "allocationStatus": "configured",
          "synthetic": true,
          "generationMethod": "floor_selected_bed_capacity_times_governed_fraction",
          "scenarioParameterIdentity": "HOSPITAL.INVENTORY.SYNTHETIC.QUALIFICATION:b8.5-v2:baseline_availability",
          "officialCapacityReference": {
            "quantity": 453,
            "unit": "beds",
            "capacityReferenceSha256": "eac6ec909452f4a2967fdb34b882d01c10f7267dda981d32fe75ed55c91338f4"
          },
          "quantity": 135,
          "unit": "bed_units",
          "resultStatus": "synthetic_value_generated",
          "limitations": [
            "Not estimated current occupancy.",
            "Not hospital-reported availability.",
            "Not a dengue bed allocation.",
            "Not validated against live hospital operations; used only to exercise preparedness software behavior."
          ]
        },
        {
          "hospitalId": "dhaka-medical-college-hospital",
          "eligibility": "potentially_eligible",
          "participationStatus": "included",
          "managementDecisionStatus": "pending_review",
          "allocationShare": "0.313669",
          "allocationStatus": "configured",
          "synthetic": true,
          "generationMethod": "floor_selected_bed_capacity_times_governed_fraction",
          "scenarioParameterIdentity": "HOSPITAL.INVENTORY.SYNTHETIC.QUALIFICATION:b8.5-v2:baseline_availability",
          "officialCapacityReference": {
            "quantity": 2600,
            "unit": "beds",
            "capacityReferenceSha256": "eac6ec909452f4a2967fdb34b882d01c10f7267dda981d32fe75ed55c91338f4"
          },
          "quantity": 780,
          "unit": "bed_units",
          "resultStatus": "synthetic_value_generated",
          "limitations": [
            "Not estimated current occupancy.",
            "Not hospital-reported availability.",
            "Not a dengue bed allocation.",
            "Not validated against live hospital operations; used only to exercise preparedness software behavior."
          ]
        },
        {
          "hospitalId": "dncc-dedicated-specialized-hospital",
          "eligibility": "not_verified",
          "participationStatus": "included",
          "managementDecisionStatus": "pending_review",
          "allocationShare": "0.127156",
          "allocationStatus": "configured",
          "synthetic": true,
          "generationMethod": "floor_selected_bed_capacity_times_governed_fraction",
          "scenarioParameterIdentity": "HOSPITAL.INVENTORY.SYNTHETIC.QUALIFICATION:b8.5-v2:baseline_availability",
          "officialCapacityReference": {
            "quantity": 1054,
            "unit": "beds",
            "capacityReferenceSha256": "eac6ec909452f4a2967fdb34b882d01c10f7267dda981d32fe75ed55c91338f4"
          },
          "quantity": 316,
          "unit": "bed_units",
          "resultStatus": "synthetic_value_generated",
          "limitations": [
            "Not estimated current occupancy.",
            "Not hospital-reported availability.",
            "Not a dengue bed allocation.",
            "Not validated against live hospital operations; used only to exercise preparedness software behavior."
          ]
        },
        {
          "hospitalId": "shaheed-suhrawardy-medical-college-hospital",
          "eligibility": "potentially_eligible",
          "participationStatus": "included",
          "managementDecisionStatus": "pending_review",
          "allocationShare": "0.162866",
          "allocationStatus": "configured",
          "synthetic": true,
          "generationMethod": "floor_selected_bed_capacity_times_governed_fraction",
          "scenarioParameterIdentity": "HOSPITAL.INVENTORY.SYNTHETIC.QUALIFICATION:b8.5-v2:baseline_availability",
          "officialCapacityReference": {
            "quantity": 1350,
            "unit": "beds",
            "capacityReferenceSha256": "eac6ec909452f4a2967fdb34b882d01c10f7267dda981d32fe75ed55c91338f4"
          },
          "quantity": 405,
          "unit": "bed_units",
          "resultStatus": "synthetic_value_generated",
          "limitations": [
            "Not estimated current occupancy.",
            "Not hospital-reported availability.",
            "Not a dengue bed allocation.",
            "Not validated against live hospital operations; used only to exercise preparedness software behavior."
          ]
        },
        {
          "hospitalId": "bangladesh-medical-university",
          "eligibility": "not_verified",
          "participationStatus": "included",
          "managementDecisionStatus": "pending_review",
          "allocationShare": null,
          "allocationStatus": "insufficient_capacity_reference",
          "synthetic": true,
          "generationMethod": "floor_selected_bed_capacity_times_governed_fraction",
          "scenarioParameterIdentity": "HOSPITAL.INVENTORY.SYNTHETIC.QUALIFICATION:b8.5-v2:baseline_availability",
          "officialCapacityReference": {
            "quantity": null,
            "unit": "beds",
            "capacityReferenceSha256": "eac6ec909452f4a2967fdb34b882d01c10f7267dda981d32fe75ed55c91338f4"
          },
          "quantity": null,
          "unit": "bed_units",
          "resultStatus": "insufficient_capacity_reference",
          "limitations": [
            "Not estimated current occupancy.",
            "Not hospital-reported availability.",
            "Not a dengue bed allocation.",
            "Not validated against live hospital operations; used only to exercise preparedness software behavior."
          ]
        },
        {
          "hospitalId": "sir-salimullah-medical-college-mitford-hospital",
          "eligibility": "potentially_eligible",
          "participationStatus": "included",
          "managementDecisionStatus": "pending_review",
          "allocationShare": "0.108578",
          "allocationStatus": "configured",
          "synthetic": true,
          "generationMethod": "floor_selected_bed_capacity_times_governed_fraction",
          "scenarioParameterIdentity": "HOSPITAL.INVENTORY.SYNTHETIC.QUALIFICATION:b8.5-v2:baseline_availability",
          "officialCapacityReference": {
            "quantity": 900,
            "unit": "beds",
            "capacityReferenceSha256": "eac6ec909452f4a2967fdb34b882d01c10f7267dda981d32fe75ed55c91338f4"
          },
          "quantity": 270,
          "unit": "bed_units",
          "resultStatus": "synthetic_value_generated",
          "limitations": [
            "Not estimated current occupancy.",
            "Not hospital-reported availability.",
            "Not a dengue bed allocation.",
            "Not validated against live hospital operations; used only to exercise preparedness software behavior."
          ]
        },
        {
          "hospitalId": "kurmitola-general-hospital",
          "eligibility": "potentially_eligible",
          "participationStatus": "included",
          "managementDecisionStatus": "pending_review",
          "allocationShare": "0.144770",
          "allocationStatus": "configured",
          "synthetic": true,
          "generationMethod": "floor_selected_bed_capacity_times_governed_fraction",
          "scenarioParameterIdentity": "HOSPITAL.INVENTORY.SYNTHETIC.QUALIFICATION:b8.5-v2:baseline_availability",
          "officialCapacityReference": {
            "quantity": 1200,
            "unit": "beds",
            "capacityReferenceSha256": "eac6ec909452f4a2967fdb34b882d01c10f7267dda981d32fe75ed55c91338f4"
          },
          "quantity": 360,
          "unit": "bed_units",
          "resultStatus": "synthetic_value_generated",
          "limitations": [
            "Not estimated current occupancy.",
            "Not hospital-reported availability.",
            "Not a dengue bed allocation.",
            "Not validated against live hospital operations; used only to exercise preparedness software behavior."
          ]
        },
        {
          "hospitalId": "railway-general-hospital-kamalapur",
          "eligibility": "not_verified",
          "participationStatus": "included",
          "managementDecisionStatus": "pending_review",
          "allocationShare": null,
          "allocationStatus": "insufficient_capacity_reference",
          "synthetic": true,
          "generationMethod": "floor_selected_bed_capacity_times_governed_fraction",
          "scenarioParameterIdentity": "HOSPITAL.INVENTORY.SYNTHETIC.QUALIFICATION:b8.5-v2:baseline_availability",
          "officialCapacityReference": {
            "quantity": null,
            "unit": "beds",
            "capacityReferenceSha256": "eac6ec909452f4a2967fdb34b882d01c10f7267dda981d32fe75ed55c91338f4"